{
  "record_type": "cam_assist_manufacturing_decision_record",
  "record_version": "1.0.0",
  "package_reference": "luthiers-toolbox:vcarve:les-paul-custom-2024",
  "created_at": "2026-06-14T20:18:05.658900Z",
  "prepared_by": "Manufacturing Engineer",
  "reviewed_by": "Senior Reviewer",
  "decision": "approved",
  "rationale": "Tooling, fixturing, and material assumptions reviewed against identified risks.",
  "authority": {
    "is_informational": true,
    "does_not_authorize_execution": true,
    "does_not_bypass_human_review": true
  },
  "assumptions_file": "examples/traceability/manufacturing_assumptions_example.json",
  "risk_file": "examples/traceability/risk_assessment_example.json"
}
